{
  "config_type": "slot_game",
  "schema_version": 1,

  "game": {
    "id": "analytics_playground",
    "name": "Analytics Playground",
    "rows": 3,
    "reel_count": 5,
    "window_offsets": [0, 1, 2]
  },

  "symbols": [
    {
      "id": "A",
      "name": "Ace",
      "kind": "regular"
    },
    {
      "id": "K",
      "name": "King",
      "kind": "regular"
    },
    {
      "id": "Q",
      "name": "Queen",
      "kind": "regular"
    },
    {
      "id": "J",
      "name": "Jack",
      "kind": "regular"
    },
    {
      "id": "10",
      "name": "Ten",
      "kind": "regular"
    }
  ],

  "reels": {
    "active_set": "base",

    "sets": {
      "base": {
        "strips": [
          ["A", "K", "Q", "J", "10", "A", "Q", "K"],
          ["K", "Q", "J", "10", "A", "K", "J", "Q"],
          ["Q", "J", "10", "A", "K", "Q", "10", "J"],
          ["J", "10", "A", "K", "Q", "J", "A", "10"],
          ["10", "A", "K", "Q", "J", "10", "K", "A"]
        ]
      }
    }
  },

  "paylines": [
    {
      "id": "top",
      "name": "Top",
      "rows": [0, 0, 0, 0, 0]
    },
    {
      "id": "middle",
      "name": "Middle",
      "rows": [1, 1, 1, 1, 1]
    },
    {
      "id": "bottom",
      "name": "Bottom",
      "rows": [2, 2, 2, 2, 2]
    },
    {
      "id": "v",
      "name": "V",
      "rows": [0, 1, 2, 1, 0]
    },
    {
      "id": "inverted_v",
      "name": "Inverted V",
      "rows": [2, 1, 0, 1, 2]
    }
  ],

  "ui": {
    "paylines": {
      "top": {
        "color": "#FF0000",
        "width": 4.0
      },
      "middle": {
        "color": "#FF5300",
        "width": 4.0
      },
      "bottom": {
        "color": "#FFA500",
        "width": 4.0
      },
      "v": {
        "color": "#FFD200",
        "width": 4.0
      },
      "inverted_v": {
        "color": "#FFFF00",
        "width": 4.0
      }
    }
  }
}